{
  "schema_version": 1,
  "project": "WARP",
  "stage": "2P-E-A",
  "note": "SOMENTE template. Deve permanecer EM BRANCO. Nao preencher este .example.json. A decisao real futura deve usar um artefato separado, fora do template, com identidade/autoridade/canal/data vindos de entrada humana (o agente nao pode inventa-los). O merge do PR nao preenche o registro nem seleciona opcao; este registro nao concede autorizacao a si mesmo.",
  "package_ref": {
    "path": "client/warp-audit/core-path-decision-package.example.json",
    "sha256": null
  },
  "status": "PENDING",
  "human_decision_required": true,
  "human_decision_received": false,
  "decider": null,
  "role": null,
  "authority": null,
  "channel": null,
  "date": null,
  "decision": null,
  "selected_option": null,
  "justification": null,
  "conditions": null,
  "validity": null,
  "decision_received": false,
  "option_selected": false,
  "source_path_authorized": false,
  "prebuilt_path_authorized": false,
  "alternative_tool_authorized": false,
  "stop_path_selected": false,
  "materialization_authorized": false,
  "build_authorized": false,
  "execution_authorized": false,
  "client_provision_authorized": false,
  "client_modification_authorized": false,
  "first_login_authorized": false
}
